sentence,label,source,length,clean_sentence,clean_length,preprocessed
He surely doesn't know how to make a coherent action movie from the screenwriter of Air Force One who was only obliged to write the script just for a big sum of money.  ,0,imdb,33,surely doesnt know make coherent action movie screenwriter air force one obliged write script big sum money,17,surely doesnt know make coherent action movie screenwriter air force one obliged write script big sum money
"As a European, the movie is a nice throwback to my time as a student in the 1980's and the experiences I had living abroad and interacting with other nationalities, although the circumstances were slightly different.  ",1,imdb,36,european movie nice throwback time student 1980s experiences living abroad interacting nationalities although circumstances slightly different,16,european movie nice throwback time student 1980s experiences living abroad interacting nationalities although circumstances slightly different
The reception is excellent!,1,amazon,4,reception excellent,2,reception excellent
I've never been more insulted or felt disrespected.,0,yelp,8,ive never insulted felt disrespected,5,ive never insulted felt disrespected
SWEETEST PHONE!!!,1,amazon,2,sweetest phone,2,sweetest phone
Any grandmother can make a roasted chicken better than this one.,0,yelp,11,grandmother make roasted chicken better one,6,grandmother make roasted chicken better one
"I let my girlfriend talk me into seeing this - bad idea, we both hated it.  ",0,imdb,16,let girlfriend talk seeing bad idea hated,7,let girlfriend talk seeing bad idea hated
This place deserves one star and 90% has to do with the food.,0,yelp,13,place deserves one star 90 food,6,place deserves one star 90 food
The last 3 times I had lunch here has been bad.,0,yelp,11,last 3 times lunch bad,5,last 3 times lunch bad
Mic Doesn't work.,0,amazon,3,mic doesnt work,3,mic doesnt work
"I also didn't like the ""on"" button, it felt like it would crack with use.",0,amazon,15,also didnt like button felt like would crack use,9,also didnt like button felt like would crack use
"Very good food, great atmosphere.1",1,yelp,5,good food great atmosphere1,4,good food great atmosphere1
This is a good joint.,1,yelp,5,good joint,2,good joint
Avoid at ALL costs!  ,0,imdb,4,avoid costs,2,avoid costs
I am very happy,1,amazon,4,happy,1,happy
"Hawaiian Breeze, Mango Magic, and Pineapple Delight are the smoothies that I've tried so far and they're all good.",1,yelp,19,hawaiian breeze mango magic pineapple delight smoothies ive tried far theyre good,12,hawaiian breeze mango magic pineapple delight smoothies ive tried far theyre good
"The meat was pretty dry, I had the sliced brisket and pulled pork.",0,yelp,13,meat pretty dry sliced brisket pulled pork,7,meat pretty dry sliced brisket pulled pork
But the premise of the film was so ridiculous: that the President of the U.S.  ,0,imdb,15,premise film ridiculous president us,5,premise film ridiculous president us
The staff was very attentive.,1,yelp,5,staff attentive,2,staff attentive
"Yes, it's that bad.  ",0,imdb,4,yes bad,2,yes bad
"Main thing I didn't enjoy is that the crowd is of older crowd, around mid 30s and up.",0,yelp,18,main thing didnt enjoy crowd older crowd around mid 30s,10,main thing didnt enjoy crowd older crowd around mid 30s
"good item, low price.",1,amazon,4,good item low price,4,good item low price
The phone takes FOREVER to charge like 2 to 5 hours literally.,0,amazon,12,phone takes forever charge like 2 5 hours literally,9,phone takes forever charge like 2 5 hours literally
Also the story and acting were weak.  ,0,imdb,7,also story acting weak,4,also story acting weak
This wonderful experience made this place a must-stop whenever we are in town again.,1,yelp,14,wonderful experience made place muststop whenever town,7,wonderful experience made place muststop whenever town
Lousy product.,0,amazon,2,lousy product,2,lousy product
They refuse to refund or replace.,0,amazon,6,refuse refund replace,3,refuse refund replace
It wasn't busy at all and now we know why.,0,yelp,10,wasnt busy know,3,wasnt busy know
Great pork sandwich.,1,yelp,3,great pork sandwich,3,great pork sandwich
BT50 battery junk!.,0,amazon,3,bt50 battery junk,3,bt50 battery junk
"Perhaps my phone is defective, but people cannot hear me when I use this.",0,amazon,14,perhaps phone defective people cannot hear use,7,perhaps phone defective people cannot hear use
This totally UNfunny movie is so over the top and pathetic and unrealistic that throughout the whole 90 minutes of utter torture I probably looked at my watch about 70000 times!  ,0,imdb,31,totally unfunny movie top pathetic unrealistic throughout whole 90 minutes utter torture probably looked watch 70000 times,17,totally unfunny movie top pathetic unrealistic throughout whole 90 minutes utter torture probably looked watch 70000 times
"Lewis Black's considerable talent is wasted here too, as he is at his most incendiary when he is unrestrained, which the PG-13 rating certainly won't allow.  ",0,imdb,26,lewis blacks considerable talent wasted incendiary unrestrained pg13 rating certainly wont allow,12,lewis blacks considerable talent wasted incendiary unrestrained pg13 rating certainly wont allow
did not like at all.,0,yelp,5,like,1,like
There is a totally unnecessary train/roller coaster scene.  ,0,imdb,8,totally unnecessary trainroller coaster scene,5,totally unnecessary trainroller coaster scene
It feels more comfortable than most headsets because I wear glasses and that gets in the way sometimes.,1,amazon,18,feels comfortable headsets wear glasses gets way sometimes,8,feels comfortable headsets wear glasses gets way sometimes
I hate those things as much as cheap quality black olives.,0,yelp,11,hate things much cheap quality black olives,7,hate things much cheap quality black olives
My fella got the huevos rancheros and they didn't look too appealing.,0,yelp,12,fella got huevos rancheros didnt look appealing,7,fella got huevos rancheros didnt look appealing
say bye bye to your tip lady!,0,yelp,7,say bye bye tip lady,5,say bye bye tip lady
Talk about USELESS customer service.,0,amazon,5,talk useless customer service,4,talk useless customer service
"The performances are real and gripping, the crocdodile is extremely well done, indeed if the Black Water website is to be believed that's because they used real crocs and the swamp location is fabulous.  ",1,imdb,34,performances real gripping crocdodile extremely well done indeed black water website believed thats used real crocs swamp location fabulous,19,performances real gripping crocdodile extremely well done indeed black water website believed thats used real crocs swamp location fabulous
Worst software ever used.... If I could give this zero stars I would.,0,amazon,13,worst software ever used could give zero stars would,9,worst software ever used could give zero stars would
We definately enjoyed ourselves.,1,yelp,4,definately enjoyed,2,definately enjoyed
The rest of the cast also play well.  ,1,imdb,8,rest cast also play well,5,rest cast also play well
"Great it was new packaged nice works good, no problems and it came in less time then I expected!!!!",1,amazon,19,great new packaged nice works good problems came less time expected,11,great new packaged nice works good problems came less time expected
Horrible!  ,0,imdb,1,horrible,1,horrible
"But the convoluted plot just didn't convince me, and much of the film was watched with a weird, questioning glance.  ",0,imdb,20,convoluted plot didnt convince much film watched weird questioning glance,10,convoluted plot didnt convince much film watched weird questioning glance
"The service was terrible, food was mediocre.",0,yelp,7,service terrible food mediocre,4,service terrible food mediocre
All of the tapas dishes were delicious!,1,yelp,7,tapas dishes delicious,3,tapas dishes delicious
I am far from a sushi connoisseur but I can definitely tell the difference between good food and bad food and this was certainly bad food.,0,yelp,26,far sushi connoisseur definitely tell difference good food bad food certainly bad food,13,far sushi connoisseur definitely tell difference good food bad food certainly bad food
"The staff is always super friendly and helpful, which is especially cool when you bring two small boys and a baby!",1,yelp,21,staff always super friendly helpful especially cool bring two small boys baby,12,staff always super friendly helpful especially cool bring two small boys baby
None of them are engaging or exciting.  ,0,imdb,7,none engaging exciting,3,none engaging exciting
I'll give this film 10 out of 10!  ,1,imdb,8,ill give film 10 10,5,ill give film 10 10
The price was very good and with the free shipping and all it was a good purchase.,1,amazon,17,price good free shipping good purchase,6,price good free shipping good purchase
Setup went very smoothly.,1,amazon,4,setup went smoothly,3,setup went smoothly
Mobile Phone Tools are a must have.,1,amazon,7,mobile phone tools must,4,mobile phone tools must
This place is awesome if you want something light and healthy during the summer.,1,yelp,14,place awesome want something light healthy summer,7,place awesome want something light healthy summer
Excellent Phone.,1,amazon,2,excellent phone,2,excellent phone
It is PERFECT for a sit-down family meal or get together with a few friends.,1,yelp,15,perfect sitdown family meal get together friends,7,perfect sitdown family meal get together friends
Very happy with this product.,1,amazon,5,happy product,2,happy product
"At first glance it is a lovely bakery cafe - nice ambiance, clean, friendly staff.",1,yelp,15,first glance lovely bakery cafe nice ambiance clean friendly staff,10,first glance lovely bakery cafe nice ambiance clean friendly staff
add betty white and jean smart and you have a great cast - everyone played their parts really well.  ,1,imdb,19,add betty white jean smart great cast everyone played parts really well,12,add betty white jean smart great cast everyone played parts really well
"Emily Watson's character is very strong, and she has only to give a quick glance and you understand everything.  ",1,imdb,19,emily watsons character strong give quick glance understand everything,9,emily watsons character strong give quick glance understand everything
Poor quality.,0,amazon,2,poor quality,2,poor quality
"***SPOILERS*** Whatever else can (or can't) be said about it, SURFACE is superbly crafted.  ",1,imdb,14,spoilers whatever else cant said surface superbly crafted,8,spoilers whatever else cant said surface superbly crafted
It's a great place and I highly recommend it.,1,yelp,9,great place highly recommend,4,great place highly recommend
"I have been in more than a few bars in Vegas, and do not ever recall being charged for tap water.",0,yelp,21,bars vegas ever recall charged tap water,7,bars vegas ever recall charged tap water
There are some generally great things in it.  ,1,imdb,8,generally great things,3,generally great things
It is very comfortable on the ear.,1,amazon,7,comfortable ear,2,comfortable ear
Watching washing machine twirling around wouldn't hurt your eyes as much as this show.  ,0,imdb,14,watching washing machine twirling around wouldnt hurt eyes much show,10,watching washing machine twirling around wouldnt hurt eyes much show
Overall I rate this movie a 10 out of a 1-10 scale.  ,1,imdb,12,overall rate movie 10 110 scale,6,overall rate movie 10 110 scale
"If you do watch it, however, there are small consolations: The actresses playing Anne's sisters each do a wonderful job with their roles.  ",1,imdb,23,watch however small consolations actresses playing annes sisters wonderful job roles,11,watch however small consolations actresses playing annes sisters wonderful job roles
":-)Oh, the charger seems to work fine.",1,amazon,7,oh charger seems work fine,5,oh charger seems work fine
"Yes, I am simplifying things here for the sake of brevity, for this really is at the core of the problems with this film - it has too much going on without any real, fulfilling explanation.  ",0,imdb,36,yes simplifying things sake brevity really core problems film much going without real fulfilling explanation,15,yes simplifying things sake brevity really core problems film much going without real fulfilling explanation
We walked away stuffed and happy about our first Vegas buffet experience.,1,yelp,12,walked away stuffed happy first vegas buffet experience,8,walked away stuffed happy first vegas buffet experience
Wonderful lil tapas and the ambience made me feel all warm and fuzzy inside.,1,yelp,14,wonderful lil tapas ambience made feel warm fuzzy inside,9,wonderful lil tapas ambience made feel warm fuzzy inside
It just blew.  ,0,imdb,3,blew,1,blew
Great product for the price!.,1,amazon,5,great product price,3,great product price
How awful she is!  ,0,imdb,4,awful,1,awful
"Overall, the film is interesting and thought-provoking.  ",1,imdb,7,overall film interesting thoughtprovoking,4,overall film interesting thoughtprovoking
-Drinks took close to 30 minutes to come out at one point.,0,yelp,12,drinks took close 30 minutes come one point,8,drinks took close 30 minutes come one point
It is easy to turn on and off when you are in the car and the volume controls are quite accessable.,1,amazon,21,easy turn car volume controls quite accessable,7,easy turn car volume controls quite accessable
Design Flaw?.,0,amazon,2,design flaw,2,design flaw
How stupid is that?,0,amazon,4,stupid,1,stupid
"Provides good protection and looks classy, too.",1,amazon,7,provides good protection looks classy,5,provides good protection looks classy
Bland and flavorless is a good way of describing the barely tepid meat.,0,yelp,13,bland flavorless good way describing barely tepid meat,8,bland flavorless good way describing barely tepid meat
"Looks great and is strong.""",1,amazon,5,looks great strong,3,looks great strong
"Obviously they have a terrible customer service, so you get what you pay for.",0,amazon,14,obviously terrible customer service get pay,6,obviously terrible customer service get pay
Buy a different phone - but not this.,0,amazon,8,buy different phone,3,buy different phone
"When it opens, the battery connection is broken and the device is turned off.",0,amazon,14,opens battery connection broken device turned,6,opens battery connection broken device turned
I highly recommend this device to everyone!,1,amazon,7,highly recommend device everyone,4,highly recommend device everyone
The cinematography-if it can be called that-sucked.  ,0,imdb,7,cinematographyif called thatsucked,3,cinematographyif called thatsucked
"Host staff were, for lack of a better word, BITCHES!",0,yelp,10,host staff lack better word bitches,6,host staff lack better word bitches
I wasn't really impressed with Strip Steak.,0,yelp,7,wasnt really impressed strip steak,5,wasnt really impressed strip steak
This is an Outstanding little restaurant with some of the Best Food I have ever tasted.,1,yelp,16,outstanding little restaurant best food ever tasted,7,outstanding little restaurant best food ever tasted
"It was either too cold, not enough flavor or just bad.",0,yelp,11,either cold enough flavor bad,5,either cold enough flavor bad
I paid too much.  ,0,imdb,4,paid much,2,paid much
"Another thing I didn't really like is when a character got punched in the face, a gallon of blood would spew forth soon after.  ",0,imdb,24,another thing didnt really like character got punched face gallon blood would spew forth soon,15,another thing didnt really like character got punched face gallon blood would spew forth soon
"It was extremely ""crumby"" and pretty tasteless.",0,yelp,7,extremely crumby pretty tasteless,4,extremely crumby pretty tasteless
"The ambiance here did not feel like a buffet setting, but more of a douchey indoor garden for tea and biscuits.",0,yelp,21,ambiance feel like buffet setting douchey indoor garden tea biscuits,10,ambiance feel like buffet setting douchey indoor garden tea biscuits
You won't be disappointed.,1,yelp,4,wont disappointed,2,wont disappointed
camera color balance is AWFUL.,0,amazon,5,camera color balance awful,4,camera color balance awful
"Yeah, the movie pretty much sucked.  ",0,imdb,6,yeah movie pretty much sucked,5,yeah movie pretty much sucked
I really like this product over the Motorola because it is allot clearer on the ear piece and the mic.,1,amazon,20,really like product motorola allot clearer ear piece mic,9,really like product motorola allot clearer ear piece mic
Food was great and so was the serivce!,1,yelp,8,food great serivce,3,food great serivce
Avoid at all cost!,0,yelp,4,avoid cost,2,avoid cost
I promise they won't disappoint.,1,yelp,5,promise wont disappoint,3,promise wont disappoint
Works great!.,1,amazon,2,works great,2,works great
Razr Battery - Good buy.,1,amazon,5,razr battery good buy,4,razr battery good buy
After receiving and using the product for just 2 days it broke.,0,amazon,12,receiving using product 2 days broke,6,receiving using product 2 days broke
So good I am going to have to review this place twice - once hereas a tribute to the place and once as a tribute to an event held here last night.,1,yelp,32,good going review place twice hereas tribute place tribute event held last night,13,good going review place twice hereas tribute place tribute event held last night
Not good by any stretch of the imagination.,0,yelp,8,good stretch imagination,3,good stretch imagination
The plot has more holes than a pair of fishnet stockings and the direction and editing is astonishingly ham fisted.  ,0,imdb,20,plot holes pair fishnet stockings direction editing astonishingly ham fisted,10,plot holes pair fishnet stockings direction editing astonishingly ham fisted
The Malta settings are as dry and as barren as the dialogue.  ,0,imdb,12,malta settings dry barren dialogue,5,malta settings dry barren dialogue
I would not recommend this place.,0,yelp,6,would recommend place,3,would recommend place
"But I recommend waiting for their future efforts, let this one go.  ",0,imdb,12,recommend waiting future efforts let one go,7,recommend waiting future efforts let one go
"It works fine on my Motorola 325 cellphone, and a lot better than the worn-out battery did.",1,amazon,17,works fine motorola 325 cellphone lot better wornout battery,9,works fine motorola 325 cellphone lot better wornout battery
The warm beer didn't help.,0,yelp,5,warm beer didnt help,4,warm beer didnt help
Integrated seamlessly with the Motorola RAZR phone.,1,amazon,7,integrated seamlessly motorola razr phone,5,integrated seamlessly motorola razr phone
Very much disappointed with this company.,0,amazon,6,much disappointed company,3,much disappointed company
you can watch them preparing the delicious food!),1,yelp,8,watch preparing delicious food,4,watch preparing delicious food
The chips and sals a here is amazing!!!!!!!!!!!!!!!!!!!,1,yelp,8,chips sals amazing,3,chips sals amazing
My friend loved the salmon tartar.,1,yelp,6,friend loved salmon tartar,4,friend loved salmon tartar
The worst piece of crap ever along with the Verizon customer service.,0,amazon,12,worst piece crap ever along verizon customer service,8,worst piece crap ever along verizon customer service
TOTAL WASTE OF TIME.,0,yelp,4,total waste time,3,total waste time
The update procedure is difficult and cumbersome.,0,amazon,7,update procedure difficult cumbersome,4,update procedure difficult cumbersome
Could not get strong enough signal.,0,amazon,6,could get strong enough signal,5,could get strong enough signal
There aren't death scenes like in previous movies and the f/x are terrible.  ,0,imdb,13,arent death scenes like previous movies fx terrible,8,arent death scenes like previous movies fx terrible
Battery has no life.,0,amazon,4,battery life,2,battery life
Stay Away From the Q!.,0,amazon,5,stay away q,3,stay away q
I'm returning them.,0,amazon,3,im returning,2,im returning
"But, in any case, the best part is, you can download these pictures to your laptop using IR, or even send pictures from your laptop to the phone.",1,amazon,28,case best part download pictures laptop using ir even send pictures laptop phone,13,case best part download pictures laptop using ir even send pictures laptop phone
THERE IS NO PLOT OR STORYLINE!!  ,0,imdb,6,plot storyline,2,plot storyline
It's uncomfortable and the sound quality is quite poor compared with the phone (Razr) or with my previous wired headset (that plugged into an LG).,0,amazon,25,uncomfortable sound quality quite poor compared phone razr previous wired headset plugged lg,13,uncomfortable sound quality quite poor compared phone razr previous wired headset plugged lg
Sauce was tasteless.,0,yelp,3,sauce tasteless,2,sauce tasteless
the phone was unusable and was not new.,0,amazon,8,phone unusable new,3,phone unusable new
The nachos are a MUST HAVE!,1,yelp,6,nachos must,2,nachos must
The headset fulfills my requirements so I am happy with my purchase.,1,amazon,12,headset fulfills requirements happy purchase,5,headset fulfills requirements happy purchase
Highly unprofessional and rude to a loyal patron!,0,yelp,8,highly unprofessional rude loyal patron,5,highly unprofessional rude loyal patron
"I have been to very few places to eat that under no circumstances would I ever return to, and this tops the list.",0,yelp,23,places eat circumstances would ever return tops list,8,places eat circumstances would ever return tops list
"I could barely stomach the meal, but didn't complain because it was a business lunch.",0,yelp,15,could barely stomach meal didnt complain business lunch,8,could barely stomach meal didnt complain business lunch
"She is as lovely as usual, this cutie!  ",1,imdb,8,lovely usual cutie,3,lovely usual cutie
"I posted more detailed comments under the grey or black phone, but i have the Fire Red and it's a great color!",1,amazon,22,posted detailed comments grey black phone fire red great color,10,posted detailed comments grey black phone fire red great color
What a mistake that was!,0,yelp,5,mistake,1,mistake
"The acting from all involved and that includes those like Shatner and Nimoy is bad and washed out and making them seem as old as they look in real life, the special effects are tacky like when Spock has to rescue Kirk on a jet pack when he falls down from a mountain.  ",0,imdb,53,acting involved includes like shatner nimoy bad washed making seem old look real life special effects tacky like spock rescue kirk jet pack falls mountain,25,acting involved includes like shatner nimoy bad washed making seem old look real life special effects tacky like spock rescue kirk jet pack falls mountain
"Let's start with all the problemsthe acting, especially from the lead professor, was very, very bad.  ",0,imdb,16,lets start problemsthe acting especially lead professor bad,8,lets start problemsthe acting especially lead professor bad
It didn't charge for me.,0,amazon,5,didnt charge,2,didnt charge
Avoid this one if you can.,0,amazon,6,avoid one,2,avoid one
Love this headset!,1,amazon,3,love headset,2,love headset
None of the three sizes they sent with the headset would stay in my ears.,0,amazon,15,none three sizes sent headset would stay ears,8,none three sizes sent headset would stay ears
So there is no way for me to plug it in here in the US unless I go by a converter.,0,amazon,21,way plug us unless go converter,6,way plug us unless go converter
The awful dialogue and hopeless overacting by everyone who gets shot top off a real waste of space and time.  ,0,imdb,20,awful dialogue hopeless overacting everyone gets shot top real waste space time,12,awful dialogue hopeless overacting everyone gets shot top real waste space time
"He is one of my favourite directors, and one of the most talented directors in the history of cinema.  ",1,imdb,19,one favourite directors one talented directors history cinema,8,one favourite directors one talented directors history cinema
Best tater tots in the southwest.,1,yelp,6,best tater tots southwest,4,best tater tots southwest
"Feelings, thoughts...Gabriel's discomfort during the dance...all these intangibles leap to life and come within the viewer's grasp in Huston's portrayal.  ",1,imdb,20,feelings thoughtsgabriels discomfort danceall intangibles leap life come within viewers grasp hustons portrayal,13,feelings thoughtsgabriels discomfort danceall intangibles leap life come within viewers grasp hustons portrayal
AMAZON SUCKS.,0,amazon,2,amazon sucks,2,amazon sucks
"And the rest of it just sits there being awful... with soldiers singing songs about the masculinity they pledge themselves to, hairsplitting about purity, the admiration of swords, etc.  ",0,imdb,29,rest sits awful soldiers singing songs masculinity pledge hairsplitting purity admiration swords etc,13,rest sits awful soldiers singing songs masculinity pledge hairsplitting purity admiration swords etc
"For those that haven't seen it, don't waste your time!  ",0,imdb,10,havent seen dont waste time,5,havent seen dont waste time
Con: spotty service.,0,yelp,3,con spotty service,3,con spotty service
I had to go to a store and bought a new NOKIA phone which is working great.,1,amazon,17,go store bought new nokia phone working great,8,go store bought new nokia phone working great
What I really like there is the crepe station.,1,yelp,9,really like crepe station,4,really like crepe station
This is a VERY average phone with bad battery life that operates on a weak network.,0,amazon,16,average phone bad battery life operates weak network,8,average phone bad battery life operates weak network
Does not fit.,0,amazon,3,fit,1,fit
Very bad Experience!,0,yelp,3,bad experience,2,bad experience
Seriously killer hot chai latte.,1,yelp,5,seriously killer hot chai latte,5,seriously killer hot chai latte
