sentence,label,source,length,clean_sentence,clean_length,preprocessed
Which is precisely why I am giving it such a bad review!  ,0,imdb,12,precisely giving bad review,4,precisely giving bad review
The battery is completely useless to me.,0,amazon,7,battery completely useless,3,battery completely useless
We won't be going back.,0,yelp,5,wont going back,3,wont going back
Good prices.,1,yelp,2,good prices,2,good prices
Case was more or less an extra that I originally put on but later discarded because it scratched my ear.,0,amazon,20,case less extra originally put later discarded scratched ear,9,case less extra originally put later discarded scratched ear
The directing is sloppy at best.  ,0,imdb,6,directing sloppy best,3,directing sloppy best
I am also very happy with the price.,1,amazon,8,also happy price,3,also happy price
Trying to make a call on these is an exercise in frustration.,0,amazon,12,trying make call exercise frustration,5,trying make call exercise frustration
"Service is quick and even ""to go"" orders are just like we like it!",1,yelp,14,service quick even go orders like like,7,service quick even go orders like like
10 out of 10 for both the movie and trilogy.  ,1,imdb,10,10 10 movie trilogy,4,10 10 movie trilogy
Clear crisp sound.,1,amazon,3,clear crisp sound,3,clear crisp sound
Thank you for wasting my money.,0,amazon,6,thank wasting money,3,thank wasting money
"Still, it was the SETS that got a big ""10"" on my ""oy-vey"" scale.  ",1,imdb,14,still sets got big 10 oyvey scale,7,still sets got big 10 oyvey scale
Great phone.,1,amazon,2,great phone,2,great phone
The result is a film that just don't look right.  ,0,imdb,10,result film dont look right,5,result film dont look right
They know how to make them here.,1,yelp,7,know make,2,know make
Does everything it should and more.,1,amazon,6,everything,1,everything
If you are Razr owner...you must have this!,1,amazon,8,razr owneryou must,3,razr owneryou must
I checked everywhere and there is no feature for it which is really disappointing.,0,amazon,14,checked everywhere feature really disappointing,5,checked everywhere feature really disappointing
"Point your finger at any item on the menu, order it and you won't be disappointed.",1,yelp,16,point finger item menu order wont disappointed,7,point finger item menu order wont disappointed
"There was NO chemistry between Ben Affleck and Sandra Bullock in this film, and I couldn't understand why he would consider even leaving his wife-to-be for this chick that he supposedly was knocked out by.  ",0,imdb,35,chemistry ben affleck sandra bullock film couldnt understand would consider even leaving wifetobe chick supposedly knocked,16,chemistry ben affleck sandra bullock film couldnt understand would consider even leaving wifetobe chick supposedly knocked
The movie is not completely perfect but 'Titta Di Girolamo' will stay with you for a long time after the vision of the movie.  ,1,imdb,24,movie completely perfect titta di girolamo stay long time vision movie,11,movie completely perfect titta di girolamo stay long time vision movie
"Unfortunately, any virtue in this film's production work was lost on a regrettable script.  ",0,imdb,14,unfortunately virtue films production work lost regrettable script,8,unfortunately virtue films production work lost regrettable script
I've had better atmosphere.,0,yelp,4,ive better atmosphere,3,ive better atmosphere
"To be honest with you, this is unbelievable nonsense and very foolish.  ",0,imdb,12,honest unbelievable nonsense foolish,4,honest unbelievable nonsense foolish
The worst phone I've ever had.... Only had it for a few months.,0,amazon,13,worst phone ive ever months,5,worst phone ive ever months
Then the film just dropped the ball.  ,0,imdb,7,film dropped ball,3,film dropped ball
The characters were all funny and had the peculiarity of not having a true lead character.  ,1,imdb,16,characters funny peculiarity true lead character,6,characters funny peculiarity true lead character
Worst ever.,0,amazon,2,worst ever,2,worst ever
All in all I give this one a resounding 9 out of 10.  ,1,imdb,13,give one resounding 9 10,5,give one resounding 9 10
"One of the most boring,pointless movies I have ever seen.  ",0,imdb,10,one boringpointless movies ever seen,5,one boringpointless movies ever seen
"I especially liked the non-cliche choices with the parents; in other movies, I could predict the dialog verbatim, but the writing in this movie made better selections.  ",1,imdb,27,especially liked noncliche choices parents movies could predict dialog verbatim writing movie made better selections,15,especially liked noncliche choices parents movies could predict dialog verbatim writing movie made better selections
This is an extraordinary film.  ,1,imdb,5,extraordinary film,2,extraordinary film
Works like a charm.. Works as advertised.,1,amazon,7,works like charm works advertised,5,works like charm works advertised
But other than that the movie seemed to drag and the heroes didn't really work for their freedom.  ,0,imdb,18,movie seemed drag heroes didnt really work freedom,8,movie seemed drag heroes didnt really work freedom
It was pretty gross!,0,yelp,4,pretty gross,2,pretty gross
Incredible!.,1,amazon,1,incredible,1,incredible
We'd definitely go back here again.,1,yelp,6,wed definitely go back,4,wed definitely go back
"The movie was so boring, that I sometimes found myself occupied peaking in the paper instead of watching (never happened during a Columbo movie before!  ",0,imdb,25,movie boring sometimes found occupied peaking paper instead watching never happened columbo movie,13,movie boring sometimes found occupied peaking paper instead watching never happened columbo movie
Overall I wasn't very impressed with Noca.,0,yelp,7,overall wasnt impressed noca,4,overall wasnt impressed noca
"There was so much hype over this phone that I assumed it was the best, my mistake.",0,amazon,17,much hype phone assumed best mistake,6,much hype phone assumed best mistake
good protection and does not make phone too bulky.,1,amazon,9,good protection make phone bulky,5,good protection make phone bulky
"They are so easy to love, but even more easy to identify with.  ",1,imdb,13,easy love even easy identify,5,easy love even easy identify
"They have a good selection of food including a massive meatloaf sandwich, a crispy chicken wrap, a delish tuna melt and some tasty burgers.",1,yelp,24,good selection food including massive meatloaf sandwich crispy chicken wrap delish tuna melt tasty burgers,15,good selection food including massive meatloaf sandwich crispy chicken wrap delish tuna melt tasty burgers
Kieslowski never ceases to amaze me.  ,1,imdb,6,kieslowski never ceases amaze,4,kieslowski never ceases amaze
I used bitpim (a free program you can find on the internet)to transfer data to the phone.The price of the cable was excellent.,1,amazon,23,used bitpim free program find internetto transfer data phonethe price cable excellent,12,used bitpim free program find internetto transfer data phonethe price cable excellent
I enjoyed reading this book to my children when they were little.  ,1,imdb,12,enjoyed reading book children little,5,enjoyed reading book children little
"It seems completely secure, both holding on to my belt, and keeping the iPhone inside.",1,amazon,15,seems completely secure holding belt keeping iphone inside,8,seems completely secure holding belt keeping iphone inside
"This movie is a pure disaster, the story is stupid and the editing is the worst I have seen, it confuses you incredibly.  ",0,imdb,23,movie pure disaster story stupid editing worst seen confuses incredibly,10,movie pure disaster story stupid editing worst seen confuses incredibly
The Han Nan Chicken was also very tasty.,1,yelp,8,han nan chicken also tasty,5,han nan chicken also tasty
There was absolutely no warmth or charm to these scenes or characters.  ,0,imdb,12,absolutely warmth charm scenes characters,5,absolutely warmth charm scenes characters
Everything stinks.  ,0,imdb,2,everything stinks,2,everything stinks
Worst Customer Service Ever.,0,amazon,4,worst customer service ever,4,worst customer service ever
Horrible - don't waste your time and money.,0,yelp,8,horrible dont waste time money,5,horrible dont waste time money
The construction of the headsets is poor.,0,amazon,7,construction headsets poor,3,construction headsets poor
I can think of no other film where something vitally important occurs every other minute.  ,1,imdb,15,think film something vitally important occurs every minute,8,think film something vitally important occurs every minute
This mostly routine fact-based TV drama gets a boost from the fine performance by Cole.  ,1,imdb,15,mostly routine factbased tv drama gets boost fine performance cole,10,mostly routine factbased tv drama gets boost fine performance cole
"Speaking of the music, it is unbearably predictably and kitchy.  ",0,imdb,10,speaking music unbearably predictably kitchy,5,speaking music unbearably predictably kitchy
I don't think it would hold it too securly on your belt.,0,amazon,12,dont think would hold securly belt,6,dont think would hold securly belt
"steve martin delivers a really funny performance of a middle-aged, upper class, uptight white guy.  ",1,imdb,15,steve martin delivers really funny performance middleaged upper class uptight white guy,12,steve martin delivers really funny performance middleaged upper class uptight white guy
"The best place in Vegas for breakfast (just check out a Sat, or Sun.",1,yelp,14,best place vegas breakfast check sat sun,7,best place vegas breakfast check sat sun
Will not be back!,0,yelp,4,back,1,back
Rating: 1 out of 10.  ,0,imdb,5,rating 1 10,3,rating 1 10
Boy was that sucker dry!!.,0,yelp,5,boy sucker dry,3,boy sucker dry
What a waste of time!,0,amazon,5,waste time,2,waste time
Also notable is John Bailey's fine crisp beautifully colored cinematography and the great production design & costumes by Eiko Ishioka who went on to do the memorable costumes for Coppola's Dracula for which she received a well deserved Oscar.  ,1,imdb,39,also notable john baileys fine crisp beautifully colored cinematography great production design costumes eiko ishioka went memorable costumes coppolas dracula received well deserved oscar,24,also notable john baileys fine crisp beautifully colored cinematography great production design costumes eiko ishioka went memorable costumes coppolas dracula received well deserved oscar
It dit not work most of the time with my Nokia 5320.,0,amazon,12,dit work time nokia 5320,5,dit work time nokia 5320
"Full of unconvincing cardboard characters it is blandly written by Edward Chodorov, who also produced, and is surprisingly directed by Jean Negulesco from whom one would expect a great deal more.  ",0,imdb,31,full unconvincing cardboard characters blandly written edward chodorov also produced surprisingly directed jean negulesco one would expect great deal,19,full unconvincing cardboard characters blandly written edward chodorov also produced surprisingly directed jean negulesco one would expect great deal
I think i was one of the people who found this another one of roth's pearls.  ,1,imdb,16,think one people found another one roths pearls,8,think one people found another one roths pearls
Please dont waste your money.,0,amazon,5,please dont waste money,4,please dont waste money
"The salad had just the right amount of sauce to not over power the scallop, which was perfectly cooked.",1,yelp,19,salad right amount sauce power scallop perfectly cooked,8,salad right amount sauce power scallop perfectly cooked
I found this product to be waaay too big.,0,amazon,9,found product waaay big,4,found product waaay big
Clever and a real crowd-pleaser--this film still ranks among Mickey's best films even after 80 wonderful years.  ,1,imdb,17,clever real crowdpleaserthis film still ranks among mickeys best films even 80 wonderful years,14,clever real crowdpleaserthis film still ranks among mickeys best films even 80 wonderful years
$50 Down the drain.,0,amazon,4,50 drain,2,50 drain
"Long, whiny and pointless.  ",0,imdb,4,long whiny pointless,3,long whiny pointless
"It ranks highly as a great noir-crime-drama, incredible performances by Belmondo and Lino Ventura.  ",1,imdb,14,ranks highly great noircrimedrama incredible performances belmondo lino ventura,9,ranks highly great noircrimedrama incredible performances belmondo lino ventura
"What did bother me, was the slow service.",0,yelp,8,bother slow service,3,bother slow service
"Even allowing for poor production values for the time (1971) and the format (some kind of mini-series), this is baaaaaad.  ",0,imdb,20,even allowing poor production values time 1971 format kind miniseries baaaaaad,11,even allowing poor production values time 1971 format kind miniseries baaaaaad
I'm very disappointed with my decision.,0,amazon,6,im disappointed decision,3,im disappointed decision
I thoroughly enjoyed it when Christopher Eccleston took control of the TARDIS and the continuation of the series.  ,1,imdb,18,thoroughly enjoyed christopher eccleston took control tardis continuation series,9,thoroughly enjoyed christopher eccleston took control tardis continuation series
"It's as continuously beautiful to look at as a Bertolucci, but the relationships here are more convincing and the narrative more engaging than some of that master's work.  ",1,imdb,28,continuously beautiful look bertolucci relationships convincing narrative engaging masters work,10,continuously beautiful look bertolucci relationships convincing narrative engaging masters work
Highly recommend for any one who has a blue tooth phone.,1,amazon,11,highly recommend one blue tooth phone,6,highly recommend one blue tooth phone
Waited and waited and waited.,0,yelp,5,waited waited waited,3,waited waited waited
"Director Paul Matthews, who also wrote/directed the weak 1995 monster movie ""Grim"", clearly doesn't know how to pace his films.  ",0,imdb,20,director paul matthews also wrotedirected weak 1995 monster movie grim clearly doesnt know pace films,15,director paul matthews also wrotedirected weak 1995 monster movie grim clearly doesnt know pace films
"The lines, the cuts, the audio, everything is wrong.  ",0,imdb,9,lines cuts audio everything wrong,5,lines cuts audio everything wrong
Go watch it!  ,1,imdb,3,go watch,2,go watch
I only hear garbage for audio.,0,amazon,6,hear garbage audio,3,hear garbage audio
The fries were great too.,1,yelp,5,fries great,2,fries great
After I pulled up my car I waited for another 15 minutes before being acknowledged.,0,yelp,15,pulled car waited another 15 minutes acknowledged,7,pulled car waited another 15 minutes acknowledged
The only thing that I think could improve is the sound leaks out from the headset.,0,amazon,16,thing think could improve sound leaks headset,7,thing think could improve sound leaks headset
It actually turned out to be pretty decent as far as B-list horror/suspense films go.  ,1,imdb,15,actually turned pretty decent far blist horrorsuspense films go,9,actually turned pretty decent far blist horrorsuspense films go
"The point is the journey, a journey that touches every member of the family.  ",1,imdb,14,point journey journey touches every member family,7,point journey journey touches every member family
I exchanged the sony ericson z500a for this and I'm pretty happy with that decision.,1,amazon,15,exchanged sony ericson z500a im pretty happy decision,8,exchanged sony ericson z500a im pretty happy decision
I was amazed at the quick arrival of the two original lg cell phone batteries and and at a fraction of the price.,1,amazon,23,amazed quick arrival two original lg cell phone batteries fraction price,11,amazed quick arrival two original lg cell phone batteries fraction price
The aerial scenes were well-done.  ,1,imdb,5,aerial scenes welldone,3,aerial scenes welldone
there are so many problems i dont know where to start.  ,0,imdb,11,many problems dont know start,5,many problems dont know start
I guess that nobody at the network that aired this dribble watched it before putting it on.  ,0,imdb,17,guess nobody network aired dribble watched putting,7,guess nobody network aired dribble watched putting
I especially love the long battery life.,1,amazon,7,especially love long battery life,5,especially love long battery life
I literally vomited while watching this film.  ,0,imdb,7,literally vomited watching film,4,literally vomited watching film
"Terrible product, and waste of money!",0,amazon,6,terrible product waste money,4,terrible product waste money
I have bought this Nokia cell phone a few weeks ago and it was a nightmare.,0,amazon,16,bought nokia cell phone weeks ago nightmare,7,bought nokia cell phone weeks ago nightmare
I would avoid this place if you are staying in the Mirage.,0,yelp,12,would avoid place staying mirage,5,would avoid place staying mirage
Awkward to use and unreliable.,0,amazon,5,awkward use unreliable,3,awkward use unreliable
It was clear that she had the range and ability to pull off this part.  ,1,imdb,15,clear range ability pull part,5,clear range ability pull part
"For a self proclaimed coffee cafe, I was wildly disappointed.",0,yelp,10,self proclaimed coffee cafe wildly disappointed,6,self proclaimed coffee cafe wildly disappointed
I love their fries and their beans.,1,yelp,7,love fries beans,3,love fries beans
"I have seen many movies starring Jaclyn Smith, but my god this was one of her best, though it came out 12 years ago.  ",1,imdb,24,seen many movies starring jaclyn smith god one best though came 12 years ago,14,seen many movies starring jaclyn smith god one best though came 12 years ago
10/10  ,1,imdb,1,1010,1,1010
"The burger is good beef, cooked just right.",1,yelp,8,burger good beef cooked right,5,burger good beef cooked right
Lately they have been extremely nice and helpful on the phone.,1,amazon,11,lately extremely nice helpful phone,5,lately extremely nice helpful phone
"It had some average acting from the main person, and it was a low budget as you clearly can see.  ",0,imdb,20,average acting main person low budget clearly see,8,average acting main person low budget clearly see
Those phones are working just fine now.,1,amazon,7,phones working fine,3,phones working fine
Perfect for the PS3.,1,amazon,4,perfect ps3,2,perfect ps3
I did not have any problem with this item and would order it again if needed.,1,amazon,16,problem item would order needed,5,problem item would order needed
"Good show, Samsung.",1,amazon,3,good show samsung,3,good show samsung
"The food was great as always, compliments to the chef.",1,yelp,10,food great always compliments chef,5,food great always compliments chef
"Pros:-Good camera - very nice pictures , also has cool styles like black and white, and more.",1,amazon,17,prosgood camera nice pictures also cool styles like black white,10,prosgood camera nice pictures also cool styles like black white
This is the phone to get for 2005.... I just bought my S710a and all I can say is WOW!,1,amazon,20,phone get 2005 bought s710a say wow,7,phone get 2005 bought s710a say wow
"And, quite honestly, often its not very good.  ",0,imdb,8,quite honestly often good,4,quite honestly often good
I'm so sorry but I really can't recommend it to anyone.  ,0,imdb,11,im sorry really cant recommend anyone,6,im sorry really cant recommend anyone
Comfort for our whole family.,1,amazon,5,comfort whole family,3,comfort whole family
I am not a filmmaker nor am I a director but I would hide my head in the sand if I'd spent whatever amount of money and time on this movie.  ,0,imdb,31,filmmaker director would hide head sand id spent whatever amount money time movie,13,filmmaker director would hide head sand id spent whatever amount money time movie
The attempts at humor were pitiful and story is so awful it dosen't bear thinking about which basically involves a Vulcan stealing the Enterprise to find god (seriously) I just didn't care about any of this film and oh not to mention Uhura does a belly dance to distract male guards.  ,0,imdb,51,attempts humor pitiful story awful dosent bear thinking basically involves vulcan stealing enterprise find god seriously didnt care film oh mention uhura belly dance distract male guards,27,attempts humor pitiful story awful dosent bear thinking basically involves vulcan stealing enterprise find god seriously didnt care film oh mention uhura belly dance distract male guards
This is hands down the best phone I've ever had.,1,amazon,10,hands best phone ive ever,5,hands best phone ive ever
Lange had become a great actress.  ,1,imdb,6,lange become great actress,4,lange become great actress
Everything about this film is simply incredible.  ,1,imdb,7,everything film simply incredible,4,everything film simply incredible
The Jabra EarGels fit my ears very well.,1,amazon,8,jabra eargels fit ears well,5,jabra eargels fit ears well
"I do love sushi, but I found Kabuki to be over-priced, over-hip and under-services.",0,yelp,14,love sushi found kabuki overpriced overhip underservices,7,love sushi found kabuki overpriced overhip underservices
"But if you liked movies like The Matrix (and better yet, their sequels) I think you'll appreciate the thought provoking, mindblowing experience this film will give you.  ",1,imdb,27,liked movies like matrix better yet sequels think youll appreciate thought provoking mindblowing experience film give,16,liked movies like matrix better yet sequels think youll appreciate thought provoking mindblowing experience film give
"After 3 months, screen just went black all of a sudden.",0,amazon,11,3 months screen went black sudden,6,3 months screen went black sudden
* Both the Hot & Sour & the Egg Flower Soups were absolutely 5 Stars!,1,yelp,15,hot sour egg flower soups absolutely 5 stars,8,hot sour egg flower soups absolutely 5 stars
This fixes all the problems.,1,amazon,5,fixes problems,2,fixes problems
Nothing at all to recommend.  ,0,imdb,5,nothing recommend,2,nothing recommend
So flavorful and has just the perfect amount of heat.,1,yelp,10,flavorful perfect amount heat,4,flavorful perfect amount heat
Generally; it just lacked imagination.  ,0,imdb,5,generally lacked imagination,3,generally lacked imagination
Awesome service and food.,1,yelp,4,awesome service food,3,awesome service food
It was a pale color instead of nice and char and has NO flavor.,0,yelp,14,pale color instead nice char flavor,6,pale color instead nice char flavor
I will be back many times soon.,1,yelp,7,back many times soon,4,back many times soon
And none of the tones is acceptable.,0,amazon,7,none tones acceptable,3,none tones acceptable
The acting by the whole cast could be put on a scale and balanced perfectly between overacting and underacting.  ,0,imdb,19,acting whole cast could put scale balanced perfectly overacting underacting,10,acting whole cast could put scale balanced perfectly overacting underacting
A usable keyboard actually turns a PDA into a real-world useful machine instead of just a neat gadget.,1,amazon,18,usable keyboard actually turns pda realworld useful machine instead neat gadget,11,usable keyboard actually turns pda realworld useful machine instead neat gadget
Bad Choice.,0,amazon,2,bad choice,2,bad choice
But it's just not funny.  ,0,imdb,5,funny,1,funny
Your brain will attempt to shut-down as part of a primal impulse of self-preservation.  ,0,imdb,14,brain attempt shutdown part primal impulse selfpreservation,7,brain attempt shutdown part primal impulse selfpreservation
"If you want a movie that's not gross but gives you some chills, this is a great choice.  ",1,imdb,18,want movie thats gross gives chills great choice,8,want movie thats gross gives chills great choice
"In short, don't bother with this movie.  ",0,imdb,7,short dont bother movie,4,short dont bother movie
The service here leaves a lot to be desired.,0,yelp,9,service leaves lot desired,4,service leaves lot desired
"I started this review with two stars, but I'm editing it to give it only one.",0,yelp,16,started review two stars im editing give one,8,started review two stars im editing give one
I was disgusted because I was pretty sure that was human hair.,0,yelp,12,disgusted pretty sure human hair,5,disgusted pretty sure human hair
Lame would be the best way to describe it.  ,0,imdb,9,lame would best way describe,5,lame would best way describe
"Bought mainly for the charger, which broke soon after purchasing.",0,amazon,10,bought mainly charger broke soon purchasing,6,bought mainly charger broke soon purchasing
This item is fantastic and works perfectly!,1,amazon,7,item fantastic works perfectly,4,item fantastic works perfectly
"not even a ""hello, we will be right with you.""",0,yelp,10,even hello right,3,even hello right
But I definitely would not eat here again.,0,yelp,8,definitely would eat,3,definitely would eat
W810i is just SUPERB.,1,amazon,4,w810i superb,2,w810i superb
Glad I didn't pay to see it.  ,0,imdb,7,glad didnt pay see,4,glad didnt pay see
It is shameful.  ,0,imdb,3,shameful,1,shameful
The problem was the script.  ,0,imdb,5,problem script,2,problem script
Dee Snider just plain sucks.  ,0,imdb,5,dee snider plain sucks,4,dee snider plain sucks
I don't recommend unless your car breaks down in front of it and you are starving.,0,yelp,16,dont recommend unless car breaks front starving,7,dont recommend unless car breaks front starving
The roast beef sandwich tasted really good!,1,yelp,7,roast beef sandwich tasted really good,6,roast beef sandwich tasted really good
Do not make the same mistake as me.,0,amazon,8,make mistake,2,make mistake
But this movie is definitely a below average rent.  ,0,imdb,9,movie definitely average rent,4,movie definitely average rent
"No additional ear gels provided, and no instructions whatsoever.",0,amazon,9,additional ear gels provided instructions whatsoever,6,additional ear gels provided instructions whatsoever
