sentence,label,source,length,clean_sentence,clean_length,preprocessed
An Awesome New Look For Fall 2000!.,1,amazon,7,awesome new look fall 2000,5,awesome new look fall 2000
"Either way, it sucks.  ",0,imdb,4,either way sucks,3,either way sucks
I wear it everyday and it holds up very well.,1,amazon,10,wear everyday holds well,4,wear everyday holds well
The sweet potato fries were very good and seasoned well.,1,yelp,10,sweet potato fries good seasoned well,6,sweet potato fries good seasoned well
Linda Cardellini is the only thing good in this film.  ,1,imdb,10,linda cardellini thing good film,5,linda cardellini thing good film
"a drive thru means you do not want to wait around for half an hour for your food, but somehow when we end up going here they make us wait and wait.",0,yelp,32,drive thru means want wait around half hour food somehow end going make us wait wait,16,drive thru means want wait around half hour food somehow end going make us wait wait
"Great product, fast shipping!.",1,amazon,4,great product fast shipping,4,great product fast shipping
"When my order arrived, one of the gyros was missing.",0,yelp,10,order arrived one gyros missing,5,order arrived one gyros missing
Sprint charges for this service.,0,amazon,5,sprint charges service,3,sprint charges service
"It works great with a car charger, especially if you cannot plug in two adapters at the same time.",1,amazon,19,works great car charger especially cannot plug two adapters time,10,works great car charger especially cannot plug two adapters time
Never got it!!!!!,0,amazon,3,never got,2,never got
An extensive menu provides lots of options for breakfast.,1,yelp,9,extensive menu provides lots options breakfast,6,extensive menu provides lots options breakfast
Don't waste your $$$ on this one.,0,amazon,7,dont waste one,3,dont waste one
"Hot dishes are not hot, cold dishes are close to room temp.I watched staff prepare food with BARE HANDS, no gloves.Everything is deep fried in oil.",0,yelp,26,hot dishes hot cold dishes close room tempi watched staff prepare food bare hands gloveseverything deep fried oil,18,hot dishes hot cold dishes close room tempi watched staff prepare food bare hands gloveseverything deep fried oil
Bland... Not a liking this place for a number of reasons and I don't want to waste time on bad reviewing.. I'll leave it at that...,0,yelp,26,bland liking place number reasons dont want waste time bad reviewing ill leave,13,bland liking place number reasons dont want waste time bad reviewing ill leave
"Great food for the price, which is very high quality and house made.",1,yelp,13,great food price high quality house made,7,great food price high quality house made
"Very convenient, since we were staying at the MGM!",1,yelp,9,convenient since staying mgm,4,convenient since staying mgm
"This product is clearly not ready for prime time, I don't care how cool it looks, if you can't tell a call is coming in it's worthless.",0,amazon,27,product clearly ready prime time dont care cool looks cant tell call coming worthless,14,product clearly ready prime time dont care cool looks cant tell call coming worthless
i got this phone around the end of may and i'm completely unhappy with it.,0,amazon,15,got phone around end may im completely unhappy,8,got phone around end may im completely unhappy
"As an earlier review noted, plug in this charger and nothing happens.",0,amazon,12,earlier review noted plug charger nothing happens,7,earlier review noted plug charger nothing happens
I got food poisoning here at the buffet.,0,yelp,8,got food poisoning buffet,4,got food poisoning buffet
It has everything I need and I couldn't ask for more.,1,amazon,11,everything need couldnt ask,4,everything need couldnt ask
The football scenes at the end were perplexing.  ,0,imdb,8,football scenes end perplexing,4,football scenes end perplexing
Service is quick and friendly.,1,yelp,5,service quick friendly,3,service quick friendly
Spend your money and time some place else.,0,yelp,8,spend money time place else,5,spend money time place else
I vomited in the bathroom mid lunch.,0,yelp,7,vomited bathroom mid lunch,4,vomited bathroom mid lunch
"I tried the Cape Cod ravoli, chicken,with cranberry...mmmm!",1,yelp,8,tried cape cod ravoli chickenwith cranberrymmmm,6,tried cape cod ravoli chickenwith cranberrymmmm
The Veggitarian platter is out of this world!,1,yelp,8,veggitarian platter world,3,veggitarian platter world
Freezes frequently4.,0,amazon,2,freezes frequently4,2,freezes frequently4
The worst one of the series.  ,0,imdb,6,worst one series,3,worst one series
"After one bite, I was hooked.",1,yelp,6,one bite hooked,3,one bite hooked
This greedy corporation will NEVER see another dime from me!,0,yelp,10,greedy corporation never see another dime,6,greedy corporation never see another dime
The script looks as if only a rough draft was written and shooting began before a finished script was completed.  ,0,imdb,20,script looks rough draft written shooting began finished script completed,10,script looks rough draft written shooting began finished script completed
Alexander Nevsky is a great film.  ,1,imdb,6,alexander nevsky great film,4,alexander nevsky great film
Last night was my second time dining here and I was so happy I decided to go back!,1,yelp,18,last night second time dining happy decided go back,9,last night second time dining happy decided go back
It is a really good show to watch.  ,1,imdb,8,really good show watch,4,really good show watch
Very well made and fits my Surefire GX2 perfectly.,1,amazon,9,well made fits surefire gx2 perfectly,6,well made fits surefire gx2 perfectly
My sister has one also and she loves it.,1,amazon,9,sister one also loves,4,sister one also loves
Chinese Forgeries Abound!.,0,amazon,3,chinese forgeries abound,3,chinese forgeries abound
"putting the race card aside, lets look at the major flaw in the film: they destroy latifa's character.  ",0,imdb,18,putting race card aside lets look major flaw film destroy latifas character,12,putting race card aside lets look major flaw film destroy latifas character
Great Value.,1,amazon,2,great value,2,great value
dont go here.,0,yelp,3,dont go,2,dont go
Their network coverage in Los Angeles is horrible.,0,amazon,8,network coverage los angeles horrible,5,network coverage los angeles horrible
A good time!,1,yelp,3,good time,2,good time
The goat taco didn't skimp on the meat and wow what FLAVOR!,1,yelp,12,goat taco didnt skimp meat wow flavor,7,goat taco didnt skimp meat wow flavor
"Both of them were truly unbelievably good, and I am so glad we went back.",1,yelp,15,truly unbelievably good glad went back,6,truly unbelievably good glad went back
I went to Bachi Burger on a friend's recommendation and was not disappointed.,1,yelp,13,went bachi burger friends recommendation disappointed,6,went bachi burger friends recommendation disappointed
Great Pocket PC / phone combination.,1,amazon,6,great pocket pc phone combination,5,great pocket pc phone combination
My drink was never empty and he made some really great menu suggestions.,1,yelp,13,drink never empty made really great menu suggestions,8,drink never empty made really great menu suggestions
"I can hear while I'm driving in the car, and usually don't even have to put it on it's loudest setting.",1,amazon,21,hear im driving car usually dont even put loudest setting,10,hear im driving car usually dont even put loudest setting
The script is a big flawed mess.  ,0,imdb,7,script big flawed mess,4,script big flawed mess
"If you love death and decay, and Shakespears lyrics... this is the one.  ",1,imdb,13,love death decay shakespears lyrics one,6,love death decay shakespears lyrics one
Nothing short of magnificent photography/cinematography in this film.  ,1,imdb,8,nothing short magnificent photographycinematography film,5,nothing short magnificent photographycinematography film
Never heard of any of them except Cole who was totally unbelievable in the part.  ,0,imdb,15,never heard except cole totally unbelievable part,7,never heard except cole totally unbelievable part
"The pizza tasted old, super chewy in not a good way.",0,yelp,11,pizza tasted old super chewy good way,7,pizza tasted old super chewy good way
Food arrived quickly!,1,yelp,3,food arrived quickly,3,food arrived quickly
Hence the whole story lacks a certain energy.  ,0,imdb,8,hence whole story lacks certain energy,6,hence whole story lacks certain energy
The art style has the appearance of crayon/pencil drawings and is wonderfully colorful and fanciful.  ,1,imdb,15,art style appearance crayonpencil drawings wonderfully colorful fanciful,8,art style appearance crayonpencil drawings wonderfully colorful fanciful
"Then our food came out, disappointment ensued.",0,yelp,7,food came disappointment ensued,4,food came disappointment ensued
The only downside is the service.,0,yelp,6,downside service,2,downside service
Due to this happening on every call I was forced to stop using this headset.,0,amazon,15,due happening every call forced stop using headset,8,due happening every call forced stop using headset
I was VERY disappointed!!,0,yelp,4,disappointed,1,disappointed
"I have had TMobile service for 2 or 3 years now, and I am pretty happy with it.",1,amazon,18,tmobile service 2 3 years pretty happy,7,tmobile service 2 3 years pretty happy
This was my first and only Vegas buffet and it did not disappoint.,1,yelp,13,first vegas buffet disappoint,4,first vegas buffet disappoint
10/10  ,1,imdb,1,1010,1,1010
Babie Bop is very cute.  ,1,imdb,5,babie bop cute,3,babie bop cute
So far it has worked like a charm.,1,amazon,8,far worked like charm,4,far worked like charm
1. long lasting battery (you don't have to recharge it as frequentyly as some of the flip phones)2.,0,amazon,18,1 long lasting battery dont recharge frequentyly flip phones2,9,1 long lasting battery dont recharge frequentyly flip phones2
We started with the tuna sashimi which was brownish in color and obviously wasn't fresh.,0,yelp,15,started tuna sashimi brownish color obviously wasnt fresh,8,started tuna sashimi brownish color obviously wasnt fresh
After trying many many handsfree gadgets this is the one that finally works well.,1,amazon,14,trying many many handsfree gadgets one finally works well,9,trying many many handsfree gadgets one finally works well
Excellent starter wireless headset.,0,amazon,4,excellent starter wireless headset,4,excellent starter wireless headset
Great place to have a couple drinks and watch any and all sporting events as the walls are covered with TV's.,1,yelp,21,great place couple drinks watch sporting events walls covered tvs,10,great place couple drinks watch sporting events walls covered tvs
What a piece of junk.. I lose more calls on this phone.,0,amazon,12,piece junk lose calls phone,5,piece junk lose calls phone
"None of it works, just don't buy it.",0,amazon,8,none works dont buy,4,none works dont buy
"My experience was terrible..... This was my fourth bluetooth headset, and while it was much more comfortable than my last Jabra (which I HATED!!!",0,amazon,24,experience terrible fourth bluetooth headset much comfortable last jabra hated,10,experience terrible fourth bluetooth headset much comfortable last jabra hated
The lighting is just dark enough to set the mood.,1,yelp,10,lighting dark enough set mood,5,lighting dark enough set mood
It really is impressive that the place hasn't closed down.,0,yelp,10,really impressive place hasnt closed,5,really impressive place hasnt closed
"Delicious NYC bagels, good selections of cream cheese, real Lox with capers even.",1,yelp,13,delicious nyc bagels good selections cream cheese real lox capers even,11,delicious nyc bagels good selections cream cheese real lox capers even
"This one wants to surf on the small wave of space movies in 1998 (Deep Impact and Armageddon), and this one fails everywhere.  ",0,imdb,23,one wants surf small wave space movies 1998 deep impact armageddon one fails everywhere,14,one wants surf small wave space movies 1998 deep impact armageddon one fails everywhere
"If you want healthy authentic or ethic food, try this place.",1,yelp,11,want healthy authentic ethic food try place,7,want healthy authentic ethic food try place
The pleather case doesn't fit.,0,amazon,5,pleather case doesnt fit,4,pleather case doesnt fit
Nice Sound.,1,amazon,2,nice sound,2,nice sound
Excellent product for the price.,1,amazon,5,excellent product price,3,excellent product price
I enjoyed it.  ,1,imdb,3,enjoyed,1,enjoyed
Their steaks are 100% recommended!,1,yelp,5,steaks 100 recommended,3,steaks 100 recommended
"Totally different, with loads of understatement and black comedy, this is a film few get to see, but those who do will remember it.  ",1,imdb,24,totally different loads understatement black comedy film get see remember,10,totally different loads understatement black comedy film get see remember
The company shipped my product very promptly and it works well.,1,amazon,11,company shipped product promptly works well,6,company shipped product promptly works well
Essentially you can forget Microsoft's tech support.,0,amazon,7,essentially forget microsofts tech support,5,essentially forget microsofts tech support
The scripting of the subtle comedy is unmatched by any movie in recent years.  ,1,imdb,14,scripting subtle comedy unmatched movie recent years,7,scripting subtle comedy unmatched movie recent years
cool phone.,1,amazon,2,cool phone,2,cool phone
I've had this for nearly 2 years and it has worked great for me.,1,amazon,14,ive nearly 2 years worked great,6,ive nearly 2 years worked great
This phone is slim and light and the display is beautiful.,1,amazon,11,phone slim light display beautiful,5,phone slim light display beautiful
"And considering the two of us left there very full and happy for about $20, you just can't go wrong.",1,yelp,20,considering two us left full happy 20 cant go wrong,10,considering two us left full happy 20 cant go wrong
Those burgers were amazing.,1,yelp,4,burgers amazing,2,burgers amazing
It's a case of 'so bad it is laughable'.  ,0,imdb,9,case bad laughable,3,case bad laughable
This is infuriating.,0,amazon,3,infuriating,1,infuriating
The RI style calamari was a joke.,0,yelp,7,ri style calamari joke,4,ri style calamari joke
This film offers many delights and surprises.  ,1,imdb,7,film offers many delights surprises,5,film offers many delights surprises
Works great.,1,amazon,2,works great,2,works great
Conclusion - I loved it.  ,1,imdb,5,conclusion loved,2,conclusion loved
"It's pretty surprising that this wonderful film was made in 1949, as Hollywood generally had its collective heads in the sand concerning black and white issues at that time.  ",1,imdb,29,pretty surprising wonderful film made 1949 hollywood generally collective heads sand concerning black white issues time,16,pretty surprising wonderful film made 1949 hollywood generally collective heads sand concerning black white issues time
I find this inexcusable and so will probably be returning this phone and perhaps changing carriers.,0,amazon,16,find inexcusable probably returning phone perhaps changing carriers,8,find inexcusable probably returning phone perhaps changing carriers
2 thumbs up to this seller,1,amazon,6,2 thumbs seller,3,2 thumbs seller
Don't miss it.  ,1,imdb,3,dont miss,2,dont miss
"No ear loop needed, it's tiny and the sound is great.",1,amazon,11,ear loop needed tiny sound great,6,ear loop needed tiny sound great
""" But ""Storm Trooper"" is not even bad enough to make it to the list of wonderfully terrible movies.  ",0,imdb,19,storm trooper even bad enough make list wonderfully terrible movies,10,storm trooper even bad enough make list wonderfully terrible movies
"It took over 30 min to get their milkshake, which was nothing more than chocolate milk.",0,yelp,16,took 30 min get milkshake nothing chocolate milk,8,took 30 min get milkshake nothing chocolate milk
"In the summer, you can dine in a charming outdoor patio - so very delightful.",1,yelp,15,summer dine charming outdoor patio delightful,6,summer dine charming outdoor patio delightful
For the price this was a great deal.,1,amazon,8,price great deal,3,price great deal
And it was boring.  ,0,imdb,4,boring,1,boring
1/10 - and only because there is no setting for 0/10.  ,0,imdb,11,110 setting 010,3,110 setting 010
It looked like a wonderful story.  ,1,imdb,6,looked like wonderful story,4,looked like wonderful story
It is very educational for children 1 to 8 years old.  ,1,imdb,11,educational children 1 8 years old,6,educational children 1 8 years old
Never going back.,0,yelp,3,never going back,3,never going back
Great price also!,1,amazon,3,great price also,3,great price also
Some may say this buffet is pricey but I think you get what you pay for and this place you are getting quite a lot!,1,yelp,25,may say buffet pricey think get pay place getting quite lot,11,may say buffet pricey think get pay place getting quite lot
"But she is still a bad actress, repeating her robotic face moves in each of her pictures.  ",0,imdb,17,still bad actress repeating robotic face moves pictures,8,still bad actress repeating robotic face moves pictures
New Battery works great in phone.,1,amazon,6,new battery works great phone,5,new battery works great phone
Would not go back.,0,yelp,4,would go back,3,would go back
This is simply the BEST bluetooth headset for sound quality!,1,amazon,10,simply best bluetooth headset sound quality,6,simply best bluetooth headset sound quality
Waiter was a jerk.,0,yelp,4,waiter jerk,2,waiter jerk
Returned 8 hours later.,0,amazon,4,returned 8 hours later,4,returned 8 hours later
"The acting, as you'd expect from this cast, is top notch.  ",1,imdb,11,acting youd expect cast top notch,6,acting youd expect cast top notch
Do not waste your money here!,0,yelp,6,waste money,2,waste money
It is a true classic.  ,1,imdb,5,true classic,2,true classic
They really want to make your experience a good one.,1,yelp,10,really want make experience good one,6,really want make experience good one
So bad...well...it's just bad.  ,0,imdb,4,badwellits bad,2,badwellits bad
I cannot make calls at certain places.,0,amazon,7,cannot make calls certain places,5,cannot make calls certain places
Don't waste your money!.,0,amazon,4,dont waste money,3,dont waste money
Totally believable.  ,1,imdb,2,totally believable,2,totally believable
"Just whatever you do, avoid ""Groove"" as its the antithesis of all that is good about Human Traffic.  ",0,imdb,18,whatever avoid groove antithesis good human traffic,7,whatever avoid groove antithesis good human traffic
Loved the casting of Jimmy Buffet as the science teacher.  ,1,imdb,10,loved casting jimmy buffet science teacher,6,loved casting jimmy buffet science teacher
I will not return.,0,yelp,4,return,1,return
I must say I have taped most of the episodes and i find myself watching them over and over again.  ,1,imdb,20,must say taped episodes find watching,6,must say taped episodes find watching
The volume switch rocketed out of the unit to a destination unknown.,0,amazon,12,volume switch rocketed unit destination unknown,6,volume switch rocketed unit destination unknown
However I needed some better instructions.,0,amazon,6,however needed better instructions,4,however needed better instructions
There is nothing privileged about working/eating there.,0,yelp,7,nothing privileged workingeating,3,nothing privileged workingeating
The ambiance isn't much better.,0,yelp,5,ambiance isnt much better,4,ambiance isnt much better
"I like the fact that it rests lightly against your ear, rather than inside.",1,amazon,14,like fact rests lightly ear rather inside,7,like fact rests lightly ear rather inside
"Frozen pucks of disgust, with some of the worst people behind the register.",0,yelp,13,frozen pucks disgust worst people behind register,7,frozen pucks disgust worst people behind register
"If there was ever a movie that needed word-of-mouth to promote, this is it.  ",1,imdb,14,ever movie needed wordofmouth promote,5,ever movie needed wordofmouth promote
"This was utterly confusing at first, which caused me to lose a couple of very, very important contacts.",0,amazon,18,utterly confusing first caused lose couple important contacts,8,utterly confusing first caused lose couple important contacts
"but it is great, i would really recommend it",1,amazon,9,great would really recommend,4,great would really recommend
"I get absolutely horrible reception in my apartment, where with other phones I have not had this problem.",0,amazon,18,get absolutely horrible reception apartment phones problem,7,get absolutely horrible reception apartment phones problem
Nicest Chinese restaurant I've been in a while.,1,yelp,8,nicest chinese restaurant ive,4,nicest chinese restaurant ive
Kind of flops around.,0,amazon,4,kind flops around,3,kind flops around
"I loved it, it was really scary.  ",1,imdb,7,loved really scary,3,loved really scary
Service is friendly and inviting.,1,yelp,5,service friendly inviting,3,service friendly inviting
"Reaching for the bottom row is uncomfortable, and the send and end keys are not where I expect them to be.3.",0,amazon,21,reaching bottom row uncomfortable send end keys expect be3,9,reaching bottom row uncomfortable send end keys expect be3
Thanks good a movie like this was done and released.  ,1,imdb,10,thanks good movie like done released,6,thanks good movie like done released
"Easily, none other cartoon made me laugh in a tender way (before getting into dark sitcoms oriented for teenagers).  ",1,imdb,19,easily none cartoon made laugh tender way getting dark sitcoms oriented teenagers,12,easily none cartoon made laugh tender way getting dark sitcoms oriented teenagers
It's this pandering to the audience that sabotages most of his films.  ,0,imdb,12,pandering audience sabotages films,4,pandering audience sabotages films
"I don't know what the big deal is about this place, but I won't be back ""ya'all"".",0,yelp,17,dont know big deal place wont back yaall,8,dont know big deal place wont back yaall
lightweight and works well.,1,amazon,4,lightweight works well,3,lightweight works well
Why was this film made?  ,0,imdb,5,film made,2,film made
The screen does get smudged easily because it touches your ear and face.,0,amazon,13,screen get smudged easily touches ear face,7,screen get smudged easily touches ear face
I thought it was bad.  ,0,imdb,5,thought bad,2,thought bad
"This place is not worth your time, let alone Vegas.",0,yelp,10,place worth time let alone vegas,6,place worth time let alone vegas
This game rocks.  ,1,imdb,3,game rocks,2,game rocks
The cashew cream sauce was bland and the vegetables were undercooked.,0,yelp,11,cashew cream sauce bland vegetables undercooked,6,cashew cream sauce bland vegetables undercooked
Filmiing was less expansive.  ,0,imdb,4,filmiing less expansive,3,filmiing less expansive
I didn't know pulled pork could be soooo delicious.,1,yelp,9,didnt know pulled pork could soooo delicious,7,didnt know pulled pork could soooo delicious
Not worth it.,0,amazon,3,worth,1,worth
Very disappointing!!!,0,yelp,2,disappointing,1,disappointing
WELL IM SATISFIED.,1,amazon,3,well im satisfied,3,well im satisfied
"He is almost unbearable to watch on screen, he has little to no charisma, and terrible comedic timing.  ",0,imdb,18,almost unbearable watch screen little charisma terrible comedic timing,9,almost unbearable watch screen little charisma terrible comedic timing
The last 15 minutes of movie are also not bad as well.  ,1,imdb,12,last 15 minutes movie also bad well,7,last 15 minutes movie also bad well
THAT one didn't work either.,0,amazon,5,one didnt work either,4,one didnt work either
""" In fact, it's hard to remember that the part of Ray Charles is being acted, and not played by the man himself.  ",1,imdb,23,fact hard remember part ray charles acted played man,9,fact hard remember part ray charles acted played man
The reception has been generally good.,1,amazon,6,reception generally good,3,reception generally good
Waitress was a little slow in service.,0,yelp,7,waitress little slow service,4,waitress little slow service
"It is very comfortable to wear as well, which is probably the most important aspect about using a case.",1,amazon,19,comfortable wear well probably important aspect using case,8,comfortable wear well probably important aspect using case
best bluetooth on the market.,1,amazon,5,best bluetooth market,3,best bluetooth market
"The only thing really worth watching was the scenery and the house, because it is beautiful.  ",1,imdb,16,thing really worth watching scenery house beautiful,7,thing really worth watching scenery house beautiful
DELICIOUS!!,1,yelp,1,delicious,1,delicious
"Often the dialogue doesn't really follow from one line to another, or fit the surroundings.  ",0,imdb,15,often dialogue doesnt really follow one line another fit surroundings,10,often dialogue doesnt really follow one line another fit surroundings
"I'd say that would be the hardest decision... Honestly, all of M's dishes taste how they are supposed to taste (amazing).",1,yelp,21,id say would hardest decision honestly ms dishes taste supposed taste amazing,12,id say would hardest decision honestly ms dishes taste supposed taste amazing
"Director Neil LaBute uses brutal violence to seperate dreams from reality, and along with the touching drama, and hilarious comedy, you can never tell what is going to happen next.  ",1,imdb,30,director neil labute uses brutal violence seperate dreams reality along touching drama hilarious comedy never tell going happen next,19,director neil labute uses brutal violence seperate dreams reality along touching drama hilarious comedy never tell going happen next
"REAL sushi lovers, let's be honest - Yama is not that good.",0,yelp,12,real sushi lovers lets honest yama good,7,real sushi lovers lets honest yama good
